<?xml version="1.0" encoding="UTF-8"?>
<xsd:schema xmlns:xsd="http://www.w3.org/2001/XMLSchema"
			xmlns:jaxb="http://java.sun.com/xml/ns/jaxb" jaxb:version="2.0">
	<xsd:annotation>
		<xsd:appinfo>
			<jaxb:schemaBindings>
				<jaxb:package name="org.elite.java.jaxb"/>
			</jaxb:schemaBindings>
		</xsd:appinfo>
	</xsd:annotation>
	<xsd:element name="Persons">
		<xsd:complexType>
			<xsd:sequence>
				<xsd:element name="Person" minOccurs="0" maxOccurs="unbounded">
					<xsd:complexType>
						<xsd:sequence>
							<xsd:element name="Name" type="xsd:string"/>
							<xsd:element name="Height" type="xsd:short"/>
							<xsd:element name="Weight" type="xsd:short"/>
						</xsd:sequence>
					</xsd:complexType>
				</xsd:element>
			</xsd:sequence>
		</xsd:complexType>
	</xsd:element>
</xsd:schema>
